# name: test/sql/variable_write.test
# description: Test variable: protocol for writing to DuckDB variables via COPY
# group: [sql]

require json

require scalarfs

# =============================================================================
# Basic COPY TO variable
# =============================================================================

# Write CSV to variable (USE_TMP_FILE false used here; default also works)
statement ok
CREATE TABLE t1 AS SELECT 1 as a, 2 as b UNION ALL SELECT 3, 4;

statement ok
COPY t1 TO 'variable:csv_out' (FORMAT csv, HEADER false, USE_TMP_FILE false);

query I
SELECT getvariable('csv_out') LIKE '1,2%';
----
true

# Write JSON to variable
statement ok
COPY t1 TO 'variable:json_out' (FORMAT json, USE_TMP_FILE false);

query I
SELECT getvariable('json_out') LIKE '{"a":1%';
----
true

statement ok
DROP TABLE t1;

# =============================================================================
# Round-trip: read -> process -> write -> read
# =============================================================================

statement ok
SET VARIABLE orig = 'x,y
10,20
30,40';

statement ok
CREATE TABLE rt AS SELECT * FROM read_csv('variable:orig');

statement ok
COPY rt TO 'variable:copy' (FORMAT csv, HEADER false, USE_TMP_FILE false);

query II
SELECT * FROM read_csv('variable:copy');
----
10	20
30	40

statement ok
DROP TABLE rt;

# =============================================================================
# Write creates new variable
# =============================================================================

statement ok
COPY (SELECT 'hello' as msg) TO 'variable:brand_new_var' (FORMAT csv, HEADER false, USE_TMP_FILE false);

query I
SELECT getvariable('brand_new_var') LIKE 'hello%';
----
true

# =============================================================================
# Overwrite existing variable
# =============================================================================

statement ok
SET VARIABLE overwrite_me = 'old value';

statement ok
COPY (SELECT 'new value' as v) TO 'variable:overwrite_me' (FORMAT csv, HEADER false, USE_TMP_FILE false);

query I
SELECT getvariable('overwrite_me') LIKE 'new value%';
----
true

# =============================================================================
# Write multiline content
# =============================================================================

statement ok
CREATE TABLE multi AS SELECT 'line1' as text UNION ALL SELECT 'line2' UNION ALL SELECT 'line3';

statement ok
COPY multi TO 'variable:multiline' (FORMAT csv, HEADER false, USE_TMP_FILE false);

query I
SELECT length(getvariable('multiline'));
----
18

statement ok
DROP TABLE multi;

# =============================================================================
# Write with special characters
# =============================================================================

statement ok
CREATE TABLE special AS SELECT 'hello,world' as a, 'with"quotes' as b;

statement ok
COPY special TO 'variable:special_chars' (FORMAT csv, HEADER false, USE_TMP_FILE false);

# CSV should properly escape the content
query I
SELECT getvariable('special_chars') LIKE '%"hello,world"%';
----
true

statement ok
DROP TABLE special;

# =============================================================================
# Note: USE_TMP_FILE (default behavior) is fully supported
# =============================================================================
# DuckDB's default COPY behavior writes to a temp file first, then moves it.
# For "variable:foo", DuckDB creates temp path "tmp_variable:foo".
#
# Our filesystem handles this by:
#   1. Recognizing both "variable:" and "tmp_variable:" prefixes
#   2. Mapping "tmp_variable:foo" to variable name "tmp_foo"
#   3. MoveFile transfers data from tmp_foo to foo
#
# See variable_tmpfile.test for explicit tests of this behavior.

# =============================================================================
# Empty writes must clear the variable, not leave the previous value behind
# =============================================================================
# COPY of an empty result produces zero bytes. That is a legitimate write of
# empty content: the target variable must end up empty, not retain whatever it
# held before the COPY.

statement ok
CREATE TABLE empty_src(a INTEGER, b INTEGER);

statement ok
INSERT INTO empty_src VALUES (1, 2);

statement ok
COPY empty_src TO 'variable:empty_target' (FORMAT csv, HEADER false, USE_TMP_FILE false);

query I
SELECT rtrim(getvariable('empty_target'), chr(10));
----
1,2

statement ok
DELETE FROM empty_src;

# Empty COPY without a temp file: variable must become empty
statement ok
COPY empty_src TO 'variable:empty_target' (FORMAT csv, HEADER false, USE_TMP_FILE false);

query I
SELECT length(getvariable('empty_target'));
----
0

# Empty COPY through the temp-file path must also succeed and clear the value
statement ok
COPY empty_src TO 'variable:empty_target2' (FORMAT csv, HEADER false, USE_TMP_FILE false);

statement ok
INSERT INTO empty_src VALUES (7, 8);

statement ok
COPY empty_src TO 'variable:empty_target2' (FORMAT csv, HEADER false, USE_TMP_FILE false);

query I
SELECT rtrim(getvariable('empty_target2'), chr(10));
----
7,8

statement ok
DELETE FROM empty_src;

statement ok
COPY empty_src TO 'variable:empty_target2' (FORMAT csv, HEADER false);

query I
SELECT length(getvariable('empty_target2'));
----
0

# An empty variable is still readable as an (empty) file
query I
SELECT length(content) FROM read_text('variable:empty_target');
----
0

statement ok
DROP TABLE empty_src;
